{
  "schemaVersion": 1,
  "clientBuild": 31,
  "catalogVersion": "build31-normalized-v1",
  "npcIds": [
    2000000, 2000001, 2000002, 2000004, 2000053, 2000059, 2000073, 2000091, 2000745, 2000757,
    2000791, 2000871, 2000923, 2000924, 2000925, 2000926, 2000927, 2000928, 2000929, 2000951,
    2000952, 2000953, 2000954, 2000955, 2000956, 2000957, 2081100, 2081101, 2081102, 2081103,
    2081104, 2081105, 2081106, 2081107, 2081108, 2081109, 2081200, 2081201, 2081202, 2081203,
    2081204, 2081205, 2081206, 2081207, 2081208, 2081209, 2081300, 2081301, 2081302, 2081303,
    2081304, 2081305, 2081306, 2081307, 2081308, 2081309, 2081400, 2081401, 2081402, 2081403,
    2081404, 2081405, 2081406, 2081407, 2081408, 2081409, 2081500, 2081501, 2081502, 2081503,
    2081504, 2081505, 2081506, 2081507, 2081508, 2081509, 2081600, 2081601, 2081602, 2081603,
    2081604, 2081605, 2081606, 2081607, 2081608, 2081609, 2081700, 2081701, 2081702, 2081703,
    2081704, 2081705, 2081706, 2081707, 2081708, 2081709, 2081800, 2081801, 2081802, 2081803,
    2081804, 2081805, 2081806, 2081807, 2081808, 2081809, 2081900, 2081901, 2081902, 2081903,
    2081904, 2081905, 2081906, 2081907, 2081908, 2081909, 2086100, 2086101, 2086102, 2086103,
    2086104, 2086105, 2086106, 2086107, 2086108, 2086109, 2086200, 2086201, 2086202, 2086203,
    2086204, 2086205, 2086206, 2086207, 2086208, 2086209, 2086300, 2086301, 2086302, 2086303,
    2086304, 2086305, 2086306, 2086307, 2086308, 2086309, 2086400, 2086401, 2086402, 2086403,
    2086404, 2086405, 2086406, 2086407, 2086408, 2086409, 2086500, 2086501, 2086502, 2086503,
    2086504, 2086505, 2086506, 2086507, 2086508, 2086509, 2086600, 2086601, 2086602, 2086603,
    2086604, 2086605, 2086606, 2086607, 2086608, 2086609, 2086700, 2086701, 2086702, 2086703,
    2086704, 2086705, 2086706, 2086707, 2086708, 2086709, 2086800, 2086801, 2086802, 2086803,
    2086804, 2086805, 2086806, 2086807, 2086808, 2086809, 2086900, 2086901, 2086902, 2086903,
    2086904, 2086905, 2086906, 2086907, 2086908, 2086909, 2090001, 2090002, 2090003, 2090004,
    2090005, 2090006, 2090007, 2090008, 2090009, 2090010, 2090011, 2090012, 2090013, 2090014,
    2090015, 2090016, 2090017, 2090018, 2090019, 2090020, 2090021, 2090022, 2090023, 2090024,
    2090025, 2090026, 2090027, 2090028, 2090029, 2090030, 2090031, 2090032, 2090033, 2090034,
    2090035, 2090036, 2090037, 2090038, 2090039, 2090040, 2090041, 2090042, 2090043, 2090044,
    2090045, 2090046, 2090047, 2090048, 2090049, 2090050, 2090051, 2090052, 2090053, 2090054,
    2090055, 2090056, 2090057, 2090058, 2090059, 2090060, 2090061, 2090062, 2090063, 2090064,
    2090065, 2090066, 2090067, 2090068, 2090069, 2090070, 2090071, 2090072, 2090073, 2090074,
    2090075, 2090076, 2090077, 2090078, 2090079, 2090080, 2090081, 2090082, 2090083, 2090084,
    2090085, 2090086, 2090087, 2090088, 2090089, 2090090, 2090091, 2090092, 2090093, 2090094,
    2090095, 2090096, 2090097, 2090098, 2090099, 2090100, 2090101, 2090102, 2090103, 2090104,
    2090105, 2090106, 2090107, 2090108, 2090109, 2090110, 2090111, 2090112, 2090113, 2090114,
    2090115, 2090116, 2090117, 2090118, 2090119, 2090120, 2090121, 2090122, 2090123, 2090124,
    2090125, 2090126, 2090127, 2090128, 2090129, 2090130, 2090131, 2090132, 2090133, 2090134,
    2090151, 2090152, 2090153, 2090154, 2090155, 2090156, 2090157, 2090158, 2090159, 2090160,
    2090161, 2090162, 2090164, 2090165, 2090166, 2090167, 2090168, 2090169, 2090170, 2090171,
    2090172, 2090173, 2090174, 2090175, 2090176, 2090177, 2090178, 2090179, 2090180, 2090181,
    2090182, 2090187, 2090188, 2090189, 2090190, 2090192, 2090193, 2090194, 2090195, 2090196,
    2090197, 2090198, 2090199, 2090216, 2090218, 2090220, 2090221, 2090222, 2090223, 2090224,
    2090225, 2090226, 2090227, 2090228, 2090229, 2090230, 2090231, 2090232, 2090233, 2090234,
    2090235, 2090236, 2090237, 2090238, 2090239, 2090240, 2090241, 2090242, 2090243, 2090244,
    2090245, 2090246, 2090247, 2090248, 2090249, 2090250, 2090251, 2090252, 2090253, 2090254,
    2090255, 2090269, 2090270, 2090271, 2090274, 2090275, 2090276, 2090277, 2090278, 2090284,
    2090285, 2090305, 2090306, 2090307, 2090308, 2090309, 2090328, 2090329, 2090330, 2090331,
    2090332, 2090333, 2090334, 2090335, 2090336, 2090337, 2090338, 2090339, 2090340, 2090341,
    2090342, 2090343, 2090344, 2090345, 2090346, 2090347, 2090360, 2090361, 2090362, 2090363,
    2090364, 2090369, 2090370, 2090371, 2090372, 2090373, 2090374, 2090381, 2090382, 2090383,
    2090384, 2090385, 2090386, 2090387, 2090388, 2090389, 2090390, 2090391, 2090392, 2090393,
    2090394, 2090395, 2090396, 2090397, 2090398, 2090401, 2090402, 2090403, 2090404, 2090405,
    2090406, 2090407, 2090408, 2090409, 2090410, 2090411, 2090412, 2090413, 2090414, 2090415,
    2090416, 2090417, 2090418, 2090419, 2090420, 2090421, 2090422, 2090423, 2090424, 2090425,
    2090426, 2090427, 2090428, 2090429, 2090430, 2090431, 2090433, 2090434, 2090435, 2090437,
    2090438, 2090439, 2090440, 2090441, 2090442, 2090443, 2090444, 2090445, 2090446, 2090447,
    2090448, 2090449, 2090451, 2090452, 2090453, 2090454, 2090455, 2090456, 2090457, 2090458,
    2090463, 2090464, 2090467, 2090468, 2090469, 2090470, 2090471, 2090479, 2090480, 2090488,
    2090491, 2090536, 2090538, 2090553, 2090554, 2090555, 2090610, 2090613, 2090614, 2090615,
    2090616, 2090617, 2090618, 2090619, 2090620, 2090621, 2090622, 2090623, 2090626, 2090629,
    2090632, 2090633, 2090634, 2090635, 2090636, 2090638, 2090639, 2090648, 2090649, 2090650,
    2090652, 2090653, 2090654, 2090655, 2090656, 2090657, 2090658, 2090662, 2090663, 2090664,
    2090665, 2090666, 2090667, 2090668, 2090669, 2090670, 2090671, 2090672, 2090673, 2090674,
    2090675, 2090680, 2090681, 2090682, 2090683, 2090684, 2090685, 2090686, 2090687, 2090688,
    2090690, 2090691, 2090692, 2090693, 2090695, 2090718, 2090719, 2090720, 2090773, 2090816,
    2090817, 2090818, 2100000, 2100001, 2100002, 2100003, 2100004, 2100005, 2100006, 2100007,
    2100008, 2100009, 2100010, 2100013, 2100014, 2100015, 2100021, 2100022, 2100023, 2100025,
    2100026, 2100027, 2100028, 2100030, 2100031, 2100032, 2100033, 2100034, 2100035, 2100036,
    2100037, 2100039, 2100040, 2100041, 2100042, 2100044, 2100046, 2100047, 2100048, 2100050,
    2100064, 2100065, 2100066, 2100067, 2100068, 2100069, 2100070, 2100071, 2100072, 2100073,
    2100074, 2100075, 2100076, 2100077, 2100078, 2100079, 2100080, 2100093, 2100095, 2100096,
    2100097, 2100098, 2100128, 2100129, 2100130, 2100131, 2100132, 2100133, 2100134, 2100141,
    2100142, 2100143, 2100144, 2100145, 2100146, 2100147, 2100148, 2100149, 2100150, 2100151,
    2100155, 2100156, 2100157, 2100158, 2100159, 2100160, 2100161, 2100162, 2100163, 2100164,
    2100165, 2100166, 2100167, 2100168, 2100169, 2100170, 2100171, 2100172, 2100173, 2100174,
    2100177, 2100178, 2100179, 2100180, 2100181, 2100182, 2100183, 2100184, 2100188, 2100189,
    2100190, 2100192, 2100205, 2100206, 2100207, 2100208, 2100209, 2100214, 2100215, 2100216,
    2100217, 2100219, 2100220, 2100222, 2100223, 2100224, 2100226, 2100231, 2100272, 2100273,
    2100274, 2100275, 2100276, 2100277, 2100281, 2100282, 2100283, 2100285, 2100286, 2100287,
    2100288, 2100289, 2100303, 2100305, 2100306, 2100343, 2100346, 2100347, 2100348, 2100349,
    2100350, 2100361, 2100362, 2100363, 2100364, 2100365, 2100366, 2100369, 2100370, 2100376,
    2100377, 2100378, 2100446, 2100448, 2100449, 2100450, 2100451, 2100452, 2100453, 2100454,
    2100455, 2100456, 2100458, 2100459, 2100460, 2100461, 2100464, 2100468, 2100469, 2100470,
    2100471, 2100472, 2100473, 2100474, 2100475, 2100476, 2100477, 2100478, 2100479, 2100480,
    2100481, 2100482, 2100550, 2100551, 2100552, 2100553, 2100554, 2100555, 2100556, 2100557,
    2100558, 2100559, 2100560, 2100561, 2100562, 2100563, 2100564, 2100565, 2100566, 2100567,
    2100568, 2100569, 2100570, 2100571, 2100572, 2100573, 2100575, 2100576, 2100577, 2100578,
    2100579, 2100580, 2100581, 2100582, 2100583, 2100584, 2100585, 2100586, 2100600, 2100601,
    2100602, 2100603, 2100604, 2100605, 2100606, 2100607, 2100608, 2100609, 2100610, 2100611,
    2100612, 2100613, 2100614, 2100615, 2100616, 2100617, 2100650, 2100651, 2100652, 2100653,
    2100654, 2100655, 2100656, 2100657, 2100658, 2100659, 2100660, 2100661, 2100662, 2100663,
    2100664, 2100665, 2100666, 2100667, 2100697, 2100698, 2100699, 2100700, 2100701, 2100702,
    2100703, 2100704, 2100705, 2100706, 2100707, 2100708, 2100709, 2100710, 2100711, 2100712,
    2100713, 2100714, 2100715, 2100716, 2100717, 2100718, 2100740, 2100741, 2100742, 2100743,
    2100744, 2100745, 2100746, 2100747, 2100748, 2100749, 2100750, 2100751, 2100752, 2100753,
    2100793, 2100794, 2100795, 2100796, 2100797, 2100798, 2100799, 2100800, 2100801, 2100802,
    2100803, 2100804, 2100805, 2100806, 2100807, 2100808, 2100809, 2100810, 2100811, 2100812,
    2100813, 2100814, 2100815, 2100816, 2100817, 2100818, 2100819, 2100820, 2100821, 2100822,
    2100823, 2100824, 2100825, 2100826, 2100827, 2100828, 2100829, 2100830, 2100831, 2100832,
    2100850, 2100851, 2100852, 2100853, 2100854, 2100855, 2100856, 2100857, 2100858, 2100859,
    2100860, 2100861, 2100862, 2100863, 2100864, 2100865, 2100866, 2100867, 2100868, 2100869,
    2100870, 2100871, 2100872, 2100873, 2100874, 2100875, 2100876, 2100877, 2100878, 2100879,
    2100900, 2100901, 2100902, 2100903, 2100904, 2100905, 2100906, 2100907, 2100908, 2100909,
    2100910, 2100911, 2100912, 2100913, 2100914, 2100950, 2100951, 2100952, 2100953, 2100954,
    2100955, 2100956, 2100957, 2100958, 2100959, 2100960, 2100961, 2100962, 2100963, 2100964,
    2100965, 2100966, 2100967, 2100968, 2100969, 2100970, 2100971, 2100972, 2100973, 2100974,
    2100975, 2100976, 2100977, 2100978, 2100979, 2100980, 2100981, 2100982, 2100983, 2100984,
    2100985, 2100986, 2100987, 2100988, 2100989, 2100990, 2100991, 2100992, 2100993, 2100994,